<?xml version="1.0" encoding="utf-8"?>
<?xml-stylesheet type="text/xsl" ?>

<!DOCTYPE MyProject SYSTEM "myDTD.dtd">
<!--Validated at: http://validator.w3.org/check   to validate <!DOCTYPE MyProject [ dtd ]>-->

<MyProject>
  <chap>
    <team wins="33" loses="33" in_division="Запад" playoffs="Отпада">Финикс Сънс</team>
    <history>
      Основан 1968 , състезаващ се в дивизия Пасифик и са единствения тим в дизивията
      който не е ситуиран в Калифорния
    </history>
    <achievments>
      <division_titles>6</division_titles>
      <conference_titles>2</conference_titles>
      <league_titles>0</league_titles>
      <notable_people>
      </notable_people>
    </achievments>

    <arena seats="19023">Еъруейс Център</arena>

    <roster>
      <player position="Плеймейкър">Стив Наш</player>
      <player position="Гард">Джерад Дъдли</player>
      <player position="Леко-Крило">Грант Хил</player>
      <player position="Тежко-Крило">Чанинг Фрай</player>
      <player position="Център">Марчин Гортат</player>
    </roster>

    <free_agent>
      <fa_name>Шанън Браун</fa_name>
      <qual_offer>2000000</qual_offer>
      <years_w_team>1</years_w_team>
    </free_agent>

    <free_agent>
      <fa_name >Робин Лопез</fa_name>
      <qual_offer matched="Да">4000000</qual_offer>
      <years_w_team>4</years_w_team>
    </free_agent>

    <star>
      <star_name>Стив Неш</star_name>
      <years_pro>14</years_pro>
      <salary>13000000</salary>
      <avg_pts>17,3</avg_pts>
    </star>
    <star>
      <star_name>Грант Хил</star_name>
      <years_pro>17</years_pro>
      <salary>6500000</salary>
      <avg_pts>13,7</avg_pts>
    </star>
    <coach salary="3000000" years_old="58">Алвин Джентри</coach>

    <add_info>
      <owner>Робърт Сарвър</owner>
      <manager>Ланс Бланкс</manager>
      <site>suns.com</site>
      <colors>Оранжево</colors>
      <value>283000000</value>
      <draft_position>13</draft_position>
      <dleague_affiliate>Бейкърсфилд Джем</dleague_affiliate>
    </add_info>

  </chap>

  <chap>
    <team wins="46" loses="20" in_division="Изток" playoffs="Класира" >Маями Хийт</team>
    <history>
      Член на югоизточната дивизия.Създаден по време на разрастването през 1988.Хийтс заедно
      с Оралндо Меджик са двата представители на Флорида
    </history>
    <achievments>
      <division_titles>8</division_titles>
      <conference_titles>2</conference_titles>
      <league_titles>1</league_titles>
      <notable_people>
      </notable_people>
    </achievments>

    <arena seats="19600">Америка Еърлайнс Арена</arena>

    <roster>
      <player position="Плеймейкър">Марио Чалмърс</player>
      <player position="Гард">Дуейн Уейдс</player>
      <player position="Леко-Крило">ЛеБрон Джеймс</player>
      <player position="Тежко-Крило">Крис Бош</player>
      <player position="Център">Джуел Антъни</player>
    </roster>

    <free_agent>
      <fa_name>Еди Къри</fa_name>
      <qual_offer>1000000</qual_offer>
      <years_w_team>1</years_w_team>
    </free_agent>

    <star>
      <star_name>ЛеБрон Джеймс</star_name>
      <years_pro>9</years_pro>
      <salary>14500000</salary>
      <avg_pts>28,0</avg_pts>
    </star>
    <star>
      <star_name>Дуейн Уейд</star_name>
      <years_pro>9</years_pro>
      <salary>14000000</salary>
      <avg_pts>25,9</avg_pts>
    </star>
    <star>
      <star_name>Крис Бош</star_name>
      <years_pro>9</years_pro>
      <salary>14500000</salary>
      <avg_pts>18,6</avg_pts>
    </star>

    <coach salary="3000000" years_old="42">Ерик Сплоестра </coach>

    <add_info>
      <owner billionaire="Да">Мики Арисон</owner>
      <manager>Пат Райли</manager>
      <site>heat.com</site>
      <colors>Тъмно-червено и черно</colors>
      <value>236000000</value>
      <draft_position>26</draft_position>
      <dleague_affiliate>Скай Форс</dleague_affiliate>
    </add_info>

  </chap>
</MyProject>
