<?xml version="1.0"?>
<!DOCTYPE chap SYSTEM "D:\Projects\ASP\ASP_NBA_Project\ASP_NBA_Project\App_Data\myDTD.dtd">
<chap>
  <team wins="46" loses="20" playoffs="Класира" in_division="Изток">Маями Хийт</team>
  <history>Член на югоизточната дивизия.Създаден по време на разрастването през 1988.Хийтс заедно с Оралндо Меджик са двата представители на Флорида.</history>
  <achievments>
    <division_titles>8</division_titles>
    <conference_titles>2</conference_titles>
    <league_titles>1</league_titles>
    <notable_people>
    </notable_people>
  </achievments>
  <arena seats="19600">Америка Еърлайнс Арена</arena>
  <roster>
    <player position="Плеймейкър">Марио Чалмърс</player>
    <player position="Гард">Дуейн Уейдс</player>
    <player position="Леко-Крило">ЛеБрон Джеймс</player>
    <player position="Тежко-Крило">Крис Бош</player>
    <player position="Център">Джуел Антъни</player>
  </roster>
  <free_agent>
    <fa_name>Еди Къри</fa_name>
    <qual_offer matched="Не">1000000</qual_offer>
    <years_w_team>1</years_w_team>
  </free_agent>
  <star>
    <star_name>ЛеБрон Джеймс</star_name>
    <years_pro>9</years_pro>
    <salary>14500000</salary>
    <avg_pts>28,0</avg_pts>
  </star>
  <coach has_title="Да" salary="3000000" years_old="42">Ерик Сплоестра</coach>
  <add_info>
    <owner billionaire="Не">Мики Арисон&lt;</owner>
    <manager>Пат Райли</manager>
    <site>heat.com</site>
    <colors>Тъмно-червено и черно</colors>
    <value>236000000</value>
    <draft_position>26</draft_position>
    <dleague_affiliate>Скай Форс</dleague_affiliate>
  </add_info>
</chap>